{
  "$schema": "https://json-schema.org/draft/2020-12/schema",
  "$id": "https://walletwall.org/schemas/zk-verifier-adapter.v1.schema.json",
  "title": "WalletWall ZK Verifier Adapter Boundary (v1)",
  "description": "Read-only boundary descriptor that ties together the SP1 ML-DSA-65 proof input (walletwall.sp1-proof-input.v1), the deterministic SP1 guest journal (160-byte public values), the gated Groth16 proof slot, and the ML-DSA evidence manifest (walletwall.ml-dsa-evidence-manifest.v1), plus the on-chain verifier role. It carries keccak256 hashes plus the journal (hashes + chainId + address) only — never raw key/signature/message bytes. It is NOT a proof, NOT production ZK verification, NOT on-chain ML-DSA verification, and NOT a production-custody or mainnet claim: the active testnet SP1 verifier is a mock and heavy proving stays gated. Research prototype; not audited; testnet/local only; no real funds. The dependency-light TypeScript validator in scripts/lib/zk-verifier-adapter.ts is the authoritative in-repo check.",
  "type": "object",
  "additionalProperties": false,
  "required": [
    "schema",
    "artifactType",
    "generatedAt",
    "algorithm",
    "onChainVerifier",
    "proofInput",
    "journal",
    "proof",
    "evidence",
    "limitations",
    "regeneration"
  ],
  "properties": {
    "schema": { "const": "walletwall.zk-verifier-adapter.v1" },
    "artifactType": { "const": "zk-verifier-adapter-boundary" },
    "generatedAt": {
      "type": "string",
      "format": "date-time",
      "pattern": "^\\d{4}-\\d{2}-\\d{2}T\\d{2}:\\d{2}:\\d{2}(\\.\\d{3})?Z$"
    },
    "algorithm": {
      "type": "object",
      "additionalProperties": false,
      "required": ["parameterSet", "fips"],
      "properties": {
        "parameterSet": { "const": "ML-DSA-65" },
        "fips": { "const": "FIPS-204" }
      }
    },
    "onChainVerifier": {
      "type": "object",
      "additionalProperties": false,
      "required": ["interface", "contract", "algorithmId", "sp1Verifier", "onChainVerification", "custody"],
      "properties": {
        "interface": { "const": "IPQCVerifier" },
        "contract": { "const": "ZKMLDSAVerifier" },
        "algorithmId": { "const": "ZK-ML-DSA-65" },
        "sp1Verifier": { "const": "mock" },
        "onChainVerification": { "const": false },
        "custody": { "const": false }
      }
    },
    "proofInput": {
      "type": "object",
      "additionalProperties": false,
      "required": ["schema", "path", "messageHash", "publicKeyHash", "signatureHash"],
      "properties": {
        "schema": { "const": "walletwall.sp1-proof-input.v1" },
        "path": { "type": "string", "minLength": 1 },
        "messageHash": { "type": "string", "pattern": "^0x[0-9a-f]{64}$" },
        "publicKeyHash": { "type": "string", "pattern": "^0x[0-9a-f]{64}$" },
        "signatureHash": { "type": "string", "pattern": "^0x[0-9a-f]{64}$" }
      }
    },
    "journal": {
      "type": "object",
      "additionalProperties": false,
      "required": ["publicValues", "publicValuesHash", "chainId", "verifierAddress"],
      "properties": {
        "publicValues": { "type": "string", "pattern": "^0x[0-9a-fA-F]{320}$" },
        "publicValuesHash": { "type": "string", "pattern": "^0x[0-9a-f]{64}$" },
        "chainId": { "type": "integer", "minimum": 0 },
        "verifierAddress": { "type": "string", "pattern": "^0x[0-9a-fA-F]{40}$" }
      }
    },
    "proof": {
      "type": "object",
      "additionalProperties": false,
      "required": ["status", "scheme", "prover", "generated", "reason"],
      "properties": {
        "status": { "type": "string", "enum": ["gated", "generated"] },
        "scheme": { "const": "groth16" },
        "prover": { "const": "sp1" },
        "generated": { "type": "boolean" },
        "reason": { "type": "string", "minLength": 1 }
      }
    },
    "evidence": {
      "type": "object",
      "additionalProperties": false,
      "required": ["manifestSchema", "manifestPath", "evidenceId"],
      "properties": {
        "manifestSchema": { "const": "walletwall.ml-dsa-evidence-manifest.v1" },
        "manifestPath": { "type": "string", "minLength": 1 },
        "evidenceId": { "type": "string", "minLength": 1 }
      }
    },
    "limitations": {
      "type": "array",
      "minItems": 1,
      "items": { "type": "string", "minLength": 1 }
    },
    "regeneration": {
      "type": "object",
      "additionalProperties": false,
      "required": ["command", "deterministic"],
      "properties": {
        "command": { "type": "string", "minLength": 1 },
        "deterministic": { "const": true }
      }
    }
  }
}
